ID  объявления,Количество комнат,Тип,Метро,Адрес,"Площадь, м2",Дом,Парковка,Цена,Телефоны,Описание,Ремонт,"Площадь комнат, м2",Балкон,Окна,Санузел,Можно с детьми/животными,Дополнительно,Название ЖК,"Высота потолков, м",Лифт,Мусоропровод,Ссылка на объявление
317409944,"2, Изолированная",Квартира,м. Бульвар Рокоссовского (18 мин пешком),"Москва, Бойцовая улица, 2/30",42.4/31.4/6.0,"8/8, Панельный",,"67900.0 руб./ За месяц, Коммунальные услуги включены, Срок аренды - Длительный, Предоплата 1 мес",+79230767162,"Впервые сдаётся просторная 2-комнатная квартира с совмещённым санузлом и балконом. Без депозита! Её можно посмотреть когда Вам удобно: бронируете время, забираете ключи или встречаетесь с нашим представителем и спокойно осматриваете. Если всё понравится, договор подпишем онлайн и будем поддерживать Вас на всех этапах аренды. 

Квартира оборудована кухонным гарнитуром, мебелью и бытовой техникой. Есть 3 телевизора, кондиционер, холодильник, стиральная машина, варочная панель, духовой шкаф, микроволновка, пылесос, фен, утюг и чайник. Полы - плитка и паркет. Проведён интернет. Окна выходят во двор. 

Собственник готов заселить не более 3 взрослых жильцов с детьми. С домашним питомцем нельзя. 

Во дворе есть бесплатная парковка и детская площадка. Дом находится в районе с развитой инфраструктурой: в пешей доступности  школы и детские сады, продуктовые магазины, кафе, медицинские центры, аптеки, салоны красоты, гипермаркет Лента, ТЦ Место встречи Янтарь и ТЦ Славич. Напротив дома стадион Сп ..., 16 фото",Евроремонт,17-15,Балкон (1),Во двор,Совмещенный (1),Можно с детьми,"Мебель в комнатах, Мебель на кухне, Душевая кабина, Стиральная машина, Кондиционер, Телевизор, Холодильник, Интернет",,2.7,Пасс (1),,https://www.cian.ru/rent/flat/317409944
317688993,"3, Изолированная",Квартира,м. Партизанская (10 мин пешком),"Москва, Ткацкая улица, 48",60.0/40.0/7.0,4/5,наземная,"75000.0 руб./ За месяц, Залог - 75000 руб., Коммунальные услуги включены, Срок аренды - Длительный, Предоплата 1 мес","+79230789176, +79230730410","Выгодное предложение! Собственник будет на подписании договора!
Оперативный  показ и заселение.
 Есть стиральная и сушильная машины. В одной из комнат установлен специальный свет для художников (свет в полдень).
 Рядом станции метро: Семеновская, Партизанская. МЦК Измайлово. В пешей доступности Измайловский парк.
 Окна выходят на улицу, что обеспечивает хорошее естественное освещение.
Развитая инфраструктура, рядом  магазины, аптеки, школа, детский сад.
Квартира готова к заселению., 12 фото",Евроремонт,,Балкон (1),Во двор,Совмещенный (1),"Можно с детьми, Можно с животными","Мебель в комнатах, Мебель на кухне, Ванна, Стиральная машина, Кондиционер, Посудомоечная машина, Телевизор, Холодильник, Интернет, Телефон",,,,Да,https://www.cian.ru/rent/flat/317688993
317914047,"2, Изолированная",Квартира,м. Бульвар Рокоссовского (16 мин пешком),"Москва, бульвар Маршала Рокоссовского, 38",55.0/35.0/15.0,9/9,наземная,"100000.0 руб./ За месяц, Залог - 100000 руб., Коммунальные услуги включены, Срок аренды - Длительный, Предоплата 1 мес","+79240816346, +79230705608","Предлагается в аренду уютная и комфортная квартира.
Все параметры и фотографии соответствуют действительности.
Квартира готова к заселению - есть всё необходимое для полноценного проживания!

Оперативный показ в удобное время. Никаких предоплат - всё честно и прозрачно!

Любые вопросы можете задать нашему брокеру по телефону в объявлении!
Эта квартира ждет Вас!, 22 фото",Дизайнерский,,Балкон (1),Во двор,Совмещенный (1),"Можно с детьми, Можно с животными","Мебель в комнатах, Мебель на кухне, Душевая кабина, Стиральная машина, Кондиционер, Посудомоечная машина, Телевизор, Холодильник, Интернет, Телефон",,,Пасс (1),Да,https://www.cian.ru/rent/flat/317914047
317217366,"2, Изолированная",Квартира,м. Преображенская площадь (4 мин пешком),"Москва, улица Девятая Рота, 25",60.0/32.0/9.0,"2/12, Кирпичный",наземная,"70000.0 руб./ За месяц, Залог - 70000 руб., Коммунальные услуги включены, Срок аренды - Длительный, Предоплата 1 мес",+79854219535,"БЕЗ КОМИССИИ
Кирпичный дом, квартира рядом с метро Преображенская площадь.
Дом расположен в тихом зеленом дворе, въезд через шлагбаум.
Сдается впервые после ремонта с заменой сантехники. В квартире 2 изолированные комнаты, большой хол, много мест хранения, 2 большие лоджии.
Из бытовой техники: стиральная машина, кондиционер, электрическая плита. По желанию арендаторов куплю кровать и холодильник. Без животных и маленьких детей. 
АГЕНТАМ НЕ ЗВОНИТЬ, их услуги не оплачиваю., 13 фото",Косметический,,Лоджия (2),Во двор,Раздельный (1),,"Мебель в комнатах, Мебель на кухне, Ванна, Стиральная машина, Кондиционер",,,Пасс (2),Да,https://www.cian.ru/rent/flat/317217366
317630089,"2, Изолированная",Квартира,м. Бульвар Рокоссовского (16 мин пешком),"Москва, Игральная улица, 10",46.0/35.0/6.0,4/9,наземная,"80000.0 руб./ За месяц, Залог - 80000 руб., Коммунальные услуги включены, Срок аренды - Длительный, Предоплата 1 мес",+79858879211,"Добрый день! Квартира чистая, тихая и уютная, в квартире есть все для комфортного проживания.

Возле дома ТЦ и все необходимое, прям у дома в 10 метрах, остановка общественного транспорта. Готовы рассматривать не только долгосрочную аренду. 

С парковкой проблем не бывает,  на удаление до двух минут есть ВСЕ! Школа, сад, поликлиники, сетевые магазины, рестораны и т.д. 

Оперативней отвечу на звонок.

-К сожалению мы не готовы рассматривать арендаторов с крупными животными а так-же требуется согласование детей дошкольного возраста., 25 фото",Дизайнерский,,Лоджия (1),Во двор,Раздельный (1),"Можно с детьми, Можно с животными","Мебель в комнатах, Мебель на кухне, Ванна, Стиральная машина, Кондиционер, Телевизор, Холодильник, Интернет",,,Пасс (1),,https://www.cian.ru/rent/flat/317630089
297940857,2,Квартира,м. Щёлковская (8 мин пешком),"Москва, 9-я Парковая улица, 43/26",60.0/35.0/10.0,"6/8, Кирпичный",наземная,"59999.0 руб./ За месяц, Залог - 59999 руб., Коммунальные услуги включены, Срок аренды - Длительный, Предоплата 1 мес",+79150676502,"РАССМОТРИМ ВСЕХ! 

ДЕПОЗИТ РАЗБИВАЕМ

Большая квартира у метро.

Комнаты 15 и 20 изолированные.
Кухня 10, большая лоджия.  Окна стеклопакеты, кондиционер. 
 
Нормальное состояние. Стиралка, холодильник, СВЧ, встроенный шкафы в комнате и прихожей.

С детьми - да.
С питомцами  - да по согласованию., 15 фото",Косметический,,,Во двор,Раздельный (1),"Можно с детьми, Можно с животными","Мебель в комнатах, Мебель на кухне, Ванна, Стиральная машина, Кондиционер, Телевизор, Холодильник, Интернет",,2.8,Пасс (2),Да,https://www.cian.ru/rent/flat/297940857
316804228,"2, Изолированная",Квартира,м. Щёлковская (7 мин пешком),"Москва, 5-я Парковая улица, 64К4",48.0/31.0/6.0,"5/5, Кирпичный",наземная,"60000.0 руб./ За месяц, Залог - 60000 руб., Коммунальные услуги включены, Срок аренды - Длительный, Предоплата 1 мес","+79151249893, +79339380534","Минимальная комиссия и отличные условия.  Добропорядочным нанимателям предлагается уютная 2-комнатная квартира. Сдается ВПЕРВЫЕ. 
Комнаты изолированные, полные света и удачи. Основательный ремонт СВЕЖИЙ, делался для себя, использовались только экологичные материалы. 
В каждой комнате по удобному дивану. Телевизора нет, но это обсуждается. Несколько современных вместительных шкафов, в которых поместится всё. 
Кухня полность укомплектована мебелью и оснащена бытовой техникой от авторитетных производителей. Газовая плита с электроджигом, электрическая духовка. 
Санузел раздельный, симпатичная плитка, сантехника в идеальном состоянии. 
Окна в зелень и тишину междомового пространства на восток, балкон обит деревом и остеклен. 

Постсталинский кирпичный дом стоит в глубине двора. Лифт и мусоропровод есть, подъезд идеально чистый, соседи благополучные. 
До метро Щелковская 7-10 минут неспешным шагом, много наземного транспорта, лёгкий выезд на МКАД. Сбалансированная инфраструктура, все магази ..., 33 фото",Евроремонт,,Балкон (1),Во двор,Раздельный (1),Можно с животными,"Мебель в комнатах, Мебель на кухне, Ванна, Стиральная машина, Кондиционер, Холодильник, Интернет",,2.8,Пасс (1),Да,https://www.cian.ru/rent/flat/316804228
193054144,"2, Смежная",Квартира,м. Сокольники (18 мин пешком),"Москва, улица Короленко, 1К8",37.0/23.0/7.0,"7/9, Кирпичный",наземная,"60000.0 руб./ За месяц, Залог - 60000 руб., Коммунальные услуги включены, Срок аренды - Длительный, Предоплата 1 мес",+79856220483,"За квартиру внесли аванс до 25 мая 2025 года. 
Предлагаем вашему вниманию уютную двухкомнатную квартиру площадью 37 кв. м на улице Короленко, 1к8. Квартира расположена на 7 этаже 9-этажного кирпичного дома, построенного в 1963 году. Жилая площадь составляет 23 кв. м, кухня — 7 кв. м. 
В наличии вся необходимая мебель как в комнатах, так и на кухне. Из техники — холодильник, телевизор и стиральная машина, кондиционер. Санузел совмещенный, с ванной. Также есть балкон.
Район обжитой, с развитой инфраструктурой. Рядом находятся школы, детские сады, клиники и магазины — все необходимое для комфортной жизни. Рядом парк, набережная. Отличная транспортная доступность., 17 фото",Косметический,,Балкон (1),На улицу,Совмещенный (1),"Можно с детьми, Можно с животными","Мебель в комнатах, Мебель на кухне, Ванна, Стиральная машина, Кондиционер, Телевизор, Холодильник, Интернет",,,Пасс (1),Да,https://www.cian.ru/rent/flat/193054144
317938353,"2, Изолированная",Квартира,м. Первомайская (12 мин пешком),"Москва, 7-я Парковая улица, 28",60.0/9.0,"9/9, Кирпичный",наземная,"65000.0 руб./ За месяц, Залог - 65000 руб., Коммунальные услуги включены, Срок аренды - Длительный, Предоплата 1 мес",+79857291390,"Ольга.
В 12 мин пешком от м.Первомайская вашему вниманию предлагается ВИДОВАЯ квартира в 9-этажном  добротном  СТАЛИНСКОМ доме.
-15 мин на метро и Вы в центре Москвы. 
 Измайлово -это один из зелёных престижных районов столицы с его красивейшими кленовыми аллеями,парками,торговыми центрами .
-Общая площадь квартиры составляет 60 кв. м, расположена на 9-м этаже 9-этажного кирпичного дома 
- Высокие потолки в 3,20  метра создают ощущение простора и легкости над зелеными насаждениями.
-2 полноценных балкона
-окна  во двор 

В квартире сделан современный ремонт. В наличии вся необходимая мебель на кухне и в комнате. 
Кухня площадью 9 кв. м оборудована современной техникой: кондиционер, холодильник, телевизор и стиральная машина.
-полы  красивый паркет+плитка
 -Планировка включает два балкона и отдельный санузел с душевой кабиной.
-две ИЗОЛИРОВАННЫЕ комнаты
Двухъярусные кровати можно убрать.Квартира не забита лишними вещами,полностью готова к заселению.

Дом находится в отличном состоянии,  ..., 22 фото",Евроремонт,,Балкон (2),Во двор,Раздельный (1),Можно с детьми,"Мебель в комнатах, Мебель на кухне, Душевая кабина, Стиральная машина, Кондиционер, Телевизор, Холодильник, Интернет",,3.0,Пасс (4),Да,https://www.cian.ru/rent/flat/317938353
284991820,"2, Изолированная",Квартира,м. Перово (19 мин пешком),"Москва, шоссе Энтузиастов, 74/2",55.0/38.0/8.0,"5/12, Кирпичный",,"67000.0 руб./ За месяц, Залог - 67000 руб., Коммунальные услуги включены, Срок аренды - Длительный, Предоплата 1 мес",+79230732168,"Сдается двухкомнатная квартира в сталинском доме. Линейка, окна во двор, есть балкон. Вся техника в рабочем состоянии . Предпочтение семье .Строго без маленьких детей и животных. Вода и свет оплачивается отдельно по счетчикам. Оперативный показ, ключи на руках., 17 фото",Евроремонт,,Балкон (1),Во двор,Раздельный (1),,"Мебель в комнатах, Мебель на кухне, Ванна, Стиральная машина, Кондиционер, Холодильник",,,Пасс (2),Да,https://www.cian.ru/rent/flat/284991820
295892040,2,Квартира,м. Первомайская (5 мин пешком),"Москва, 9-я Парковая улица, 5",50.0/35.0/8.0,"5/12, Блочный",наземная,"68000.0 руб./ За месяц, Залог - 68000 руб., Коммунальные услуги включены, Срок аренды - Длительный, Предоплата 1 мес","+79190508124, +79108413002","Сдаем чистую квартиру, комнаты смежные, рассмотрим до 3 человек, можно с 1 ребенком от 7 лет, строго без животных. В квартире: газовая плита, тв, стиралка, пылесос, душевая кабина, свч, кондиционер, диван и кровать. показ и заезд после 20 мая., 13 фото",Евроремонт,,Лоджия (1),Во двор,Совмещенный (1),Можно с детьми,"Мебель в комнатах, Мебель на кухне, Душевая кабина, Стиральная машина, Кондиционер, Посудомоечная машина, Телевизор, Холодильник, Интернет",,2.6,Пасс (2),Да,https://www.cian.ru/rent/flat/295892040
317868799,"2, Изолированная",Квартира,м. Измайлово (13 мин пешком),"Москва, Мироновская улица, 9/28",46.0/31.0/8.0,"9/12, Кирпичный",наземная,"69000.0 руб./ За месяц, Залог - 35000 руб., Коммунальные услуги включены, Срок аренды - Длительный, Предоплата 1 мес",+79230741780,"Сдаю прекрасную 2-х комнатную квартиру недалеко от Измайловского парка. Квартира полностью меблирована,  заезжай и живи. Удобная планировка. Чистый подъезд, обустроенный двор, отличная инфраструктура района. Тихие соседи. Оперативный показ., 14 фото",Косметический,,Лоджия (1),Во двор,Раздельный (1),Можно с детьми,"Мебель в комнатах, Мебель на кухне, Ванна, Стиральная машина, Кондиционер, Телевизор, Холодильник, Интернет",,2.6,Пасс (2),Да,https://www.cian.ru/rent/flat/317868799
317725631,"2, Оба варианта",Квартира,м. Новогиреево (2 мин пешком),"Москва, Зеленый проспект, 60/35",45.0/28.0/6.5,7/9,наземная,"70000.0 руб./ За месяц, Залог - 70000 руб., Коммунальные услуги включены, Срок аренды - Длительный, Предоплата 1 мес",+79894080736,"ВНЕСЕН АВАНС ДО 16 часов 25 МАЯ!!!
Сдается прекрасная ЕВРО ДВУШКА прям у входа в метро Новогиреево!!! 
Кухня/гостиная + спальня + гардеробная, совмещенный санузел с душевой кабиной. 
В квартире есть всё: 
-кровать 1,6х2, диван, столы, стулья, зеркала, шкафы и полки. 
Техника: 
-два телевизора 46"", два дизайнерских кондиционера, пылесос, утюг, встроенный холодильник и микроволновая печь, плита, СМА...
В квартире не идеально свежий, но стильный дизайнерский ремонт в хорошем смысле слова ДИЗАЙНЕРСКИЙ. Балкон не застеклен. 
Чистый отремонтированный подъезд без посторонних запахов, новый лифт!
Важнейший бонус: -расположение, 20 (двадцать) МЕТРОВ от входа в метро Новогиреево, до подъезда. Кирпичный дом-зимой очень тепло, окна смотрят строго на запад откуда по вечерам открывается вид на прекрасный закат. 
Парковка наземная за шлагбаумом!
СУПЕР АДЕКВАТНЫЙ СОБСТВЕННИК!!!!!!!!!!
Идеальный вариант для холостяка или молодой пары без детей и домашних питомцев. Звоните в любое время, уважаемые клиен ..., 26 фото",Дизайнерский,,Балкон (1),На улицу,Совмещенный (1),,"Мебель в комнатах, Мебель на кухне, Душевая кабина, Стиральная машина, Кондиционер, Телевизор, Холодильник, Интернет",,,Пасс (1),Да,https://www.cian.ru/rent/flat/317725631
