ID  объявления,Количество комнат,Тип,Метро,Адрес,"Площадь, м2",Дом,Парковка,Цена,Телефоны,Описание,Ремонт,"Площадь комнат, м2",Балкон,Окна,Санузел,Можно с детьми/животными,Дополнительно,Название ЖК,"Высота потолков, м",Лифт,Мусоропровод,Ссылка на объявление
317413683,"2, Изолированная",Квартира,м. Перово (17 мин пешком),"Москва, 1-я Владимирская улица, 9",45.0/28.0/6.0,2/9,наземная,"65000.0 руб./ За месяц, Залог - 65000 руб., Коммунальные услуги включены, Срок аренды - Длительный, Предоплата 1 мес",+79771399353,"Сдается уютная двухкомнатная квартира в районе метро Перово. Общая площадь — 45 кв. м, жилая — 30 кв. м, кухня — 8 кв. м. Квартира располагается на 2-м этаже 9-этажного дома, в котором есть пассажирский лифт. До метро можно дойти пешком за 15 минут.

В квартире сделан косметический ремонт, она полностью готова для комфортного проживания. В комнатах и на кухне есть вся необходимая мебель. Из техники доступны кондиционер, холодильник, телевизор и стиральная машина. Отдельный санузел оснащен ванной, поэтому можно расслабиться после рабочего дня. Есть подключение к интернету.

Вокруг дома развитая инфраструктура: рядом расположены школы, детские сады, клиники и различные магазины, что делает проживание здесь удобным и комфортным.

Условия аренды: договор аренды заключается на длительный срок. Требуется залог в размере месячной платы. Возможно проживание семьи или компании из двух-трех человек. Комиссия агенту составляет 50% от месячной арендной платы.

Приглашаем вас на просмотр квартиры в ..., 12 фото",Косметический,,,На улицу,Раздельный (1),"Можно с детьми, Можно с животными","Мебель в комнатах, Мебель на кухне, Ванна, Стиральная машина, Кондиционер, Телевизор, Холодильник, Интернет",,,Пасс (1),,https://www.cian.ru/rent/flat/317413683
