ID  объявления,Количество комнат,Тип,Метро,Адрес,"Площадь, м2",Дом,Парковка,Цена,Телефоны,Описание,Ремонт,"Площадь комнат, м2",Балкон,Окна,Санузел,Можно с детьми/животными,Дополнительно,Название ЖК,Серия дома,"Высота потолков, м",Лифт,Мусоропровод,Ссылка на объявление
317522243,"2, Изолированная",Квартира,м. Бескудниково (14 мин пешком),"Москва, Дубнинская улица, 26К1",91.0/45.0/15.0,"4/13, Кирпичный",наземная,"85000.0 руб./ За месяц, Залог - 85000 руб., Коммунальные услуги включены, Срок аренды - Длительный, Предоплата 1 мес",+79152884510,"Лучшее предложение в районе!!!
Светлая,просторная и очень уютная  квартира  на длительный срок.Общая площадь квартиры составляет 91 кв. м., комнаты 20 и 25 кв.м,  кухня — 15 с выходом на просторную, застекленную лоджию .Высокие потолки  3  метра добавляют простора. Отдельная комната-гардеробная, просто мечта.

Квартира с евроремонтом, полностью готова к проживанию. В комнатах и на кухне есть вся необходимая мебель для комфортного проживания.Из техники в вашем распоряжении кондиционер, холодильник, стиральная машина и телевизор. В  санузле с окном установлены  ванна и душевая кабина, биде, есть бойлер на случай отключения горячей воды.
Дом в отличном состоянии, оснащён пассажирским и грузовым лифтами, а также мусоропроводом. Для вашего автомобиля предусмотрена наземная парковка. 

Район, в котором расположена квартира, отличается развитой инфраструктурой. В пешей доступности находятся школы, детские сады, клиники и магазины. Доступность трёх станций метро:""Селигерская"".  ""Яхромская"",""Ве ..., 38 фото",Евроремонт,,Лоджия (1),На улицу и двор,Совмещенный (1),,"Мебель в комнатах, Мебель на кухне, Ванна, Душевая кабина, Стиральная машина, Кондиционер, Телевизор, Холодильник, Интернет",,,2.9,"Пасс (1), Груз (1)",Да,https://www.cian.ru/rent/flat/317522243
176138158,"2, Изолированная",Квартира,м. Аэропорт (5 мин пешком),"Москва, Красноармейская улица, 23",60.0/34.0/10.0,"3/9, Кирпичный",,"87000.0 руб./ За месяц, Залог - 87000 руб., Коммунальные услуги включены, Срок аренды - Длительный, Предоплата 1 мес",+79386612417,"Квартира будет сдаваться в аренду с 3 го Июня можно заезжать и жить, показы квартиры  и договор аренды можно подписать  по договоренности уже. 
От метро 4 минуты пешком. 
ЖК ""Советский писатель"". 
Сдается двух-комнатная квартира. Евро ремонт.  
Комнаты раздельные. 
Сан-Узел раздельный, огороженная территория. 
 На длительный срок. 
Best apartment. With good repair., 10 фото",Евроремонт,,Балкон (1),На улицу и двор,,,"Мебель в комнатах, Мебель на кухне, Ванна, Стиральная машина, Кондиционер, Телевизор, Холодильник, Интернет, Телефон",,,3.0,Пасс (1),Да,https://www.cian.ru/rent/flat/176138158
317721349,"2, Смежная",Квартира,м. Белорусская (11 мин пешком),"Москва, улица Правды, 6/34",58.4/34.0/12.0,"7/8, Кирпичный",наземная,"90000.0 руб./ За месяц, Залог - 90000 руб., Коммунальные услуги включены, Срок аренды - Длительный, Предоплата 1 мес",+79339379983,"Ссылка на видео (youtube) по запросу. Отличный вариант для тех кто ищет на длительный срок. Подписание договора дистанционно,-собственник живет в другом городе. Квартира в классическом стиле. Большая спальня, кухня отделена от гостиной аркой. Если ищете квартиру со свежим ремонтом и новой мебелью,- данный объект  не для вас. Новые холодильник, стиральная машина, свч, телевизор. собственник готов в счет оплаты купить новый матрас,Нет ПММ. Большой совмещенный санузел, с ванной и душевой кабиной. Полы паркет- плитка, кондиционеры, стены под покрас, балкон застеклен. Двор огорожен (пульт предоставляется , - парковка во дворе стихийная, с местами проблем не бывает). Идеальный вариант для одного человека или пары.
Динамичный район с развитой инфраструктурой, метро в пешей доступности, удобный выезд как в сторону центра так и на основные магистрали севера и на ТТК., 12 фото",Косметический,,Балкон (1),На улицу,Совмещенный (1),,"Мебель в комнатах, Мебель на кухне, Ванна, Душевая кабина, Стиральная машина, Кондиционер, Телевизор, Холодильник, Интернет",,,3.2,Пасс (1),Да,https://www.cian.ru/rent/flat/317721349
265286783,"2, Изолированная",Квартира,м. Сокол (5 мин пешком),"Москва, 1-й Балтийский переулок, 4",45.0/28.0/7.0,"1/5, Кирпичный",наземная,"99000.0 руб./ За месяц, Залог - 99000 руб., Коммунальные услуги включены, Срок аренды - Длительный, Предоплата 1 мес",+79850007185,"5 минут пешком от метро Сокол!!! Стильная квартира в 5 минутах пешком от метро Сокол. Квартира находится в теплом кирпичном доме с отличной звукоизоляцией. Окна выходят в тихий двор с постоянным наличием свободных парковочных мест. 
В квартире выполнен хороший ремонт и она в прекрасном состоянии: чистая, светлая и уютная. Изолированные комнаты  и вместительная Гардеробная. Есть вся необходимая для комфортного проживания мебель и техника: Кондиционер, Телевизор со Smart TV, Холодильник, Посудомоечная машина, Духовой шкаф, Газовая плита, Микроволновая печь, Чайник электрический, Капсульная кофемашина, Встроенный фильтр для питьевой воды, Микроволновая печь, Стиральная машина, Утюг, Гладильная доска, Сушилка для белья и необходимая Посуда. Установлен Водонагреватель  на случай плановых отключений горячего водоснабжения.  В гостиной: удобный  раскладывающийся угловой диван. В спальне: большая двухспальная кровать с подъемным механизмом и местом для хранения. 
Высота потолков 3,4 метра, что ..., 22 фото",Дизайнерский,,,Во двор,Совмещенный (1),Можно с животными,"Мебель в комнатах, Мебель на кухне, Душевая кабина, Стиральная машина, Кондиционер, Посудомоечная машина, Телевизор, Холодильник, Интернет",,,3.5,,,https://www.cian.ru/rent/flat/265286783
317662037,"2, Изолированная",Квартира,м. Беговая (5 мин пешком),"Москва, 1-й Хорошевский проезд, 6",50.0/30.0/9.0,"2/4, Кирпичный",наземная,"100000.0 руб./ За месяц, Залог - 100000 руб., Коммунальные услуги включены, Срок аренды - Длительный, Предоплата 1 мес","+79165404319, +79161832451","Огороженная территория. Парковка во дворе, всегда есть парковочные места. Тихий двор.
Потолки 3 метра. Кондиционер. Видеодомофон. Интернет. На кухне гарнитур со встроенной техникой, посудомоечная машина, варочная панель, духовой шкаф, микроволновая печь, вытяжка, холодильник, обеденный стол, стулья. Комнаты изолированные. Санузел раздельный, душевая ниша, раковина, стиральная машина, биде. В прихожей встроенный шкаф, большое зеркало. В спальне шкаф, кровать двуспальная. В гостиной диван с французской раскладушкой, комод, телевизор. На длительный срок. Залог возможно разбить на две части, 17 фото",Дизайнерский,,,На улицу и двор,Раздельный (1),"Можно с детьми, Можно с животными","Мебель в комнатах, Мебель на кухне, Душевая кабина, Стиральная машина, Кондиционер, Посудомоечная машина, Телевизор, Холодильник, Интернет",,,3.1,,,https://www.cian.ru/rent/flat/317662037
241080579,3,Квартира,м. Аэропорт (2 мин пешком),"Москва, улица Черняховского, 3",63.4,"7/7, Кирпичный",,"100000.0 руб./ За месяц, Залог - 100000 руб., Коммунальные услуги включены, Срок аренды - Длительный, Предоплата 1 мес",+79852420448,"Сдается чистая, уютная квартира. Вся мебель и техника в наличии. Замечательная хозяйка, обо всем можно договориться. Рассмотрим наличный и безналичный расчёт. Оперативный показ, ключи на руках. Звоните., 18 фото",Косметический,,Балкон (1),Во двор,Совмещенный (1),"Можно с детьми, Можно с животными","Мебель в комнатах, Мебель на кухне, Ванна, Стиральная машина, Кондиционер, Телевизор, Холодильник, Интернет",,,,Пасс (1),Да,https://www.cian.ru/rent/flat/241080579
317362166,"2, Изолированная",Квартира,м. Аэропорт (7 мин пешком),"Москва, улица Константина Симонова, 4",58.0/9.0,3/9,наземная,"100000.0 руб./ За месяц, Залог - 100000 руб., Коммунальные услуги включены, Срок аренды - Длительный, Предоплата 1 мес",+79921285342,"Готова к заселению.
      Предлагается на длительный срок 2-х комнатная квартира в 5-6 мин. пешком от м. Аэропорт. 
       В квартире качественный евроремонт (комнаты изолированы). Вторая линия домов от проспекта, в квартире тихо. Комнаты на 2 стороны. Большой балкон (7м.). Полы с подогревом. Встроенная кухня с немецкой бытовой техникой Miele (посудомоечная машина, измельчитель мусора, фильтр для воды, вытяжка, духовка и т.д.). Санузел совмещен (душ.кабина).
       Въезд во двор через шлагбаум, парковка во дворе. 
       Данное предложение для нанимателей без домашних питомцев и детей.
       Коммунальные платежи включены в арендную плату, дополнительно оплата по счетчикам и за интернет., 18 фото",Дизайнерский,,Балкон (1),Во двор,Совмещенный (1),,"Мебель в комнатах, Мебель на кухне, Душевая кабина, Стиральная машина, Кондиционер, Посудомоечная машина, Телевизор, Холодильник, Интернет",,,,Пасс (1),Да,https://www.cian.ru/rent/flat/317362166
249727726,"3, Оба варианта",Квартира,м. Динамо (4 мин пешком),"Москва, Ленинградский проспект, 33К1",75.0/44.5/8.5,"2/7, Кирпичный",наземная,"100000.0 руб./ За месяц, Залог - 100000 руб., Коммунальные услуги включены, Срок аренды - Длительный, Предоплата 1 мес","+79678494974, +79801319127","У собственника есть свои предпочтения, БЕЗ животных, БЕЗ оформления регистрации!!.  СРОК: желательно 11-месяцев+пролонгация.  ОПЛАТА: 1-месяц+залог+счетчики-БЕЗ КОМИССИИ!.  Адрес:  ЛЕНИНГРАДСКИЙ ПРОСПЕКТ, д.33к1, кирпич, шлагбаум, подъезд (видеонаблюдение, лифт, тамбур).  СОСТОЯНИЕ-косметика-2021г.: сейф-дверь, паркет+плитка, двери-массив дерева, стеклопакеты.  СТУДИЯ (кухня-гостиная), шкаф-купе, спальня, детская, Гардеробная.  КУХНЯ: гарнитур с врезной мойкой, обеденная группа.  ТЕХНИКА: газ-панель, духовой+вытяжной шкафы, холодильник, свч, стиральная+посудомоечная машины, бойлер, пылесос, Кондиционер-3шт.  САНУЗЕЛ: совмещен, евростандарт, ванна. ТВ-плазма, интернет-МГТС/роутер, видеодомофон+домофон, ОХРАНА-сигнализация.  ЛОКАЦИЯ: м.Динамо+Беговая, ТТК., 28 фото",Евроремонт,,,На улицу и двор,Совмещенный (1),Можно с детьми,"Мебель в комнатах, Мебель на кухне, Ванна, Стиральная машина, Кондиционер, Посудомоечная машина, Телевизор, Холодильник, Интернет, Телефон",,,2.7,Пасс (1),Да,https://www.cian.ru/rent/flat/249727726
315462797,"3, Оба варианта",Квартира,м. Савёловская (8 мин пешком),"Москва, улица Нижняя Масловка, 8",54.1/24.0/18.0,"6/9, Кирпичный",наземная,"100000.0 руб./ За месяц, Залог - 100000 руб., Коммунальные услуги включены, Срок аренды - Длительный, Предоплата 1 мес","+79104891525, +79150066289","Предлагается в аренду уютная и стильная трехкомнатная квартира , с дизайнерским ремонтом, в хорошем состоянии, расположенная всего в 5 минутах пешком от метро Савеловская БКЛ и в 6 минутах от метро Савеловская серой ветки. По сути квартира является евротрешкой общей площадью 54,1 квадратных метра, жилая площадь, две изолированные комнаты— 24 квадратных метра, гардеробная 6 кв.м. и просторная кухня-гостиная - 18 квадратных метров. Квартира находится на 6 этаже 9-этажного кирпичного дома.
Важно! Дом стоит торцом к ТТК, а квартира расположена в дальнем от ТТК предпоследнем подъезде, поэтому шум от машин не слышен.
В квартире выполнен дизайнерский ремонт, который превращает пространство в комфортное и современное место для жизни. В комнатах есть вся необходимая мебель и кондиционеры (3 штуки - в каждом помещении). Всю одежду и личные вещи можно разместить на оборудованных местах хранения, которые расположены в коридоре в гардеробной и встроенных шкафах-купе. На кухне — современная техника, ..., 26 фото",Дизайнерский,,Балкон (1),На улицу и двор,Совмещенный (1),"Можно с детьми, Можно с животными","Мебель в комнатах, Мебель на кухне, Ванна, Стиральная машина, Кондиционер, Телевизор, Холодильник, Интернет",,,,Пасс (1),Да,https://www.cian.ru/rent/flat/315462797
278931028,3,Квартира,м. Моссельмаш (10 мин пешком),"Москва, Солнечногорская улица, 5К1",61.0,"5/5, Кирпичный",наземная,"100000.0 руб./ За месяц, Залог - 110000 руб., Коммунальные услуги включены, Срок аренды - Длительный, Предоплата 1 мес",+79150681371,"Пожалуйста, подробно читайте описание. показы возможны с 10 мая, заселение с начала июня. ПИШИТЕ, не звоните. АГЕНТОВ просьба не беспокоить! Сдается прекрасная уютная трёхкомнатная квартира в сталинской пятиэтажке с лифтом, в доме, где Сбербанк. Планировка: прихожая с гардеробом, кухня с гостиной (большая комната), спальня с небольшим гардеробом, вторая спальня (детская), совмещенный санузел. Инверторный кондиционер в гостиной, на полу - паркетная доска, деревянные подоконники, навесной потолок (не натяжной), электрокамин, все из натуральных материалов. В квартире останутся книги в гостиной и коробки, которые будут в гардеробе на верхних полках. Тихий спокойный район, всегда есть парковочные места вокруг дома, детская площадка, прекрасная инфраструктура- магазины (Перекресток, Пятерочка, Вкусвилл, КиБ), почта, Ozon, Boxberry, Wildberries, аптеки, СМ Клиника в соседнем доме, остановки автобуса, недалеко -Грачевский парк и Головинские Пруды. Обращаю внимание на то, что дом старый, то ест ..., 35 фото",Дизайнерский,,,На улицу и двор,Совмещенный (1),"Можно с детьми, Можно с животными","Мебель в комнатах, Мебель на кухне, Ванна, Стиральная машина, Кондиционер, Телевизор, Холодильник, Интернет",,,3.1,Пасс (1),Нет,https://www.cian.ru/rent/flat/278931028
317642998,"2, Оба варианта",Квартира,м. Войковская (22 мин пешком),"Москва, улица Зои и Александра Космодемьянских, 35/1",52.5/27.1/8.1,4/7,наземная,"100000.0 руб./ За месяц, Залог - 100000 руб., Коммунальные услуги включены, Срок аренды - Длительный, Предоплата 1 мес",+79852540072,"Сдаётся в аренду уютная двухкомнатная квартира площадью 52,5 кв. м на 4 этаже семиэтажного кирпичного дома. Расположена в тихом районе неподалёку от метро ""Красный Балтиец""  или ""Войковская"". Дом оснащён пассажирским лифтом и наземной парковкой, что делает проживание здесь особенно комфортным.

Квартира с дизайнерским ремонтом из дорогих ,импортных материалов и вниманием к деталям. Светлая гостиная и уютная спальня оборудованы всей необходимой мебелью. Кровать в спальне оборудована хорошим ортопедическим матрасом. Имеется гардеробная.В квартире сделана шумоизоляция. Кухня площадью 8,1 кв. м включает современную технику: холодильник, посудомоечную машину и кондиционер, включая мелкую бытовую технику.Ванная комната оборудована дорогой импортной сантехникой и плиткой,имеется душевая кабина и ванна, стиральная машина с функцией сушки , подогрев полв в ванной и кухне.Балкон с видом во двор обеспечивает дополнительное пространство для отдыха. В квартире проведён интернет, поэтому вы всегда б ..., 26 фото",Дизайнерский,,Балкон (1),Во двор,Совмещенный (1),Можно с детьми,"Мебель в комнатах, Мебель на кухне, Ванна, Душевая кабина, Стиральная машина, Кондиционер, Посудомоечная машина, Телевизор, Холодильник, Интернет",,,,Пасс (1),Да,https://www.cian.ru/rent/flat/317642998
