ID  объявления,Количество комнат,Тип,Метро,Адрес,"Площадь, м2",Дом,Парковка,Цена,Телефоны,Описание,Ремонт,"Площадь комнат, м2",Балкон,Окна,Санузел,Можно с детьми/животными,Дополнительно,Название ЖК,Серия дома,"Высота потолков, м",Лифт,Мусоропровод,Ссылка на объявление
312270548,2,Квартира,м. Речной вокзал (9 мин пешком),"Москва, Флотская улица, 16",45.0/25.0/6.0,"7/9, Кирпичный",наземная,"45000.0 руб./ За месяц, Залог - 45000 руб., Коммунальные услуги включены, Срок аренды - Длительный, Предоплата 1 мес",+79175131625,"ПРОСМОТРЫ ПОСЛЕ 30-ГО МАЯ! Рядом парк. Развитая инфраструктура. Длительный срок аренды. Строго без животных., 8 фото",Косметический,,Балкон (1),Во двор,Раздельный (1),Можно с детьми,"Мебель в комнатах, Мебель на кухне, Ванна, Стиральная машина, Кондиционер, Холодильник, Интернет",,,,Пасс (1),Да,https://www.cian.ru/rent/flat/312270548
317750932,"2, Изолированная",Квартира,м. Лианозово (12 мин пешком),"Москва, Дмитровское шоссе, 131К1",42.0/26.0/6.0,"2/9, Кирпичный",,"53000.0 руб./ За месяц, Залог - 53000 руб., Коммунальные услуги включены, Срок аренды - Длительный, Предоплата 1 мес","+79337869013, +79163309603","Небольшая уютная двухкомнатная квартира в кирпичном доме. Вся необходимая для проживания мебель и бытовая техника, включая кондиционер, в наличие. Комнаты изолированные, балкона нет, санузел раздельный, без ванной- душевая. СТРОГО без животных! 
-------
Примечание: у собственника есть дополнительные пожелания к жильцам - обсудите их в чате или по телефону																														 Лот: 283472901, 12 фото",Косметический,17-9,,,Раздельный (1),Можно с детьми,"Мебель в комнатах, Мебель на кухне, Ванна, Душевая кабина, Стиральная машина, Кондиционер, Телевизор, Холодильник, Интернет, Телефон",,,,"Пасс (1), Груз (1)",,https://www.cian.ru/rent/flat/317750932
317517426,2,Квартира,м. Селигерская (10 мин пешком),"Москва, Дмитровское шоссе, 90К1",51.0/30.5/10.0,"5/17, Панельный",,"63000.0 руб./ За месяц, Залог - 63000 руб., Коммунальные услуги включены, Срок аренды - Длительный, Предоплата 1 мес",+79230773759,"Предлагается двухкомнатная квартира в пешей доступности от метро ""Селигерская"". Жилые комнаты располагают системами хранения и раскладными диванами. Кухня оснащена гарнитуром с бытовой техникой, включая микроволновую печь. Для поддержания микроклимата установлен кондиционер.

Развитая инфраструктура: супермаркеты, кафе, фитнес-клубы, салоны красоты, торговые и медицинские центры. Для прогулок подойдут парк имени Святослава Фёдорова и Бескудниковский бульвар. Удобный выезд на Дмитровское шоссе и МКАД.

 - Страховой депозит можно оплатить 2-мя частями.
 - Квартиру представляет агент Capital Mars - Александр.
 - ID объекта 245302., 16 фото",,,Балкон (1),Во двор,Раздельный (1),Можно с детьми,"Мебель в комнатах, Ванна, Стиральная машина, Кондиционер, Интернет",,П44Т,2.6,"Пасс (1), Груз (1)",,https://www.cian.ru/rent/flat/317517426
315315376,2,Квартира,м. Селигерская (10 мин пешком),"Москва, Дмитровское шоссе, 90К1",51.0/30.5/9.7,"5/17, Кирпичный",наземная,"64000.0 руб./ За месяц, Залог - 64000 руб., Коммунальные услуги включены, Срок аренды - Длительный, Предоплата 1 мес",+79168835238,"Собственник.Кондиционер. Кофемашина.Балкон.Повышенный комфорт. Квартира , как евротрешка. Чистая .после косметического ремонта.Окна на тихий зеленый бульвар. Целый день солнечный свет. Уникальное местоположение для мегаполиса. Дом на холме ,видовая панорамма до центра города.Нет шума дорог, нет домов заграждающих Солнце. Не серая . Не в бетоне.Нет шума от постоянного ремонта соседей , как в ЖК.Чистый воздух, удобства и комфорт, будут лучшим местом для отдыха и хорошего настроения.  Метро в 5 минутах пешком.  Парк .Квартира прекрасно подойдет для семейных пар от 35 лет (с детьми от 21 лет )или коллег по ,,цеху,,. 2 спальных места 150х190. Без животных , без детей. в квартире не курят. Установлены уличные фильтры для очистки воздуха в помещении, что позволяет закрыть окна и отдыхать в полной тишине.Жкх  по счетчикам. Страховой депозит , возвращаемый, с условиями полного порядка, при завершении договора.Дом находится под охраной . Есть парковка под шлагбаумом с охраной системой., 21 фото",Косметический,,Балкон (1),Во двор,Раздельный (1),,"Мебель в комнатах, Мебель на кухне, Ванна, Стиральная машина, Кондиционер, Телевизор, Холодильник, Интернет",,,2.65,"Пасс (1), Груз (1)",Да,https://www.cian.ru/rent/flat/315315376
317401581,"2, Изолированная",Квартира,м. Войковская (4 мин пешком),"Москва, улица Зои и Александра Космодемьянских, 4К3",56.0/34.0/9.2,"5/8, Кирпичный",наземная,"70000.0 руб./ За месяц, Залог - 70000 руб., Коммунальные услуги включены, Срок аренды - Длительный, Предоплата 1 мес",+79339362405,"Сдаётся 2- комнатная квартира в шаговой доступности от метро Войковская. Квартира с изолированными комнатами(20,14),в жилом состоянии, со всей необходимой мебелью и техникой. Рядом вся необходимая инфраструктура: магазины, кафе, школа итд. Предпочтение в найме- семье., 13 фото",,,Балкон (1),На улицу и двор,Раздельный (1),"Можно с детьми, Можно с животными","Мебель в комнатах, Мебель на кухне, Душевая кабина, Стиральная машина, Кондиционер, Телевизор, Холодильник, Интернет",,,2.7,Пасс (1),Да,https://www.cian.ru/rent/flat/317401581
315693687,3,Квартира,м. Коптево (14 мин пешком),"Москва, Онежская улица, 15",80.0/50.0/8.7,3/5,наземная,"70000.0 руб./ За месяц, Залог - 70000 руб., Коммунальные услуги включены, Срок аренды - Длительный, Предоплата 1 мес",+79339380774,"Предложение, от которого сложно отказаться: просторная 3-комнатная квартира в сталинском доме на Онежской!

Мечтаете о комфортной жизни в тихом районе? Эта светлая и уютная 3-комнатная квартира площадью 80 м² на улице Онежская, 15 ждет именно вас! 

Преимущества, которые вы оцените:

• Идеальное расположение: Исторический район с развитой инфраструктурой, где все необходимое находится в шаговой доступности.
• Простор и уют: Изолированные комнаты, большая и функциональная кухня-гостиная создают комфортное пространство для жизни и отдыха.
• Сталинский дом с характером: Высокие потолки (3 метра) и кирпичные стены добавляют квартире особый шарм и создают ощущение простора и свободы.
• Все готово к проживанию: Квартира сдается впервые после качественной уборки и оборудована всей необходимой техникой:
  • Встроенная кухня с посудомоечной машиной, духовым шкафом и микроволновкой.
  • Холодильник.
  • Стиральная машина.
  • Мультиварка - для вкусных и полезных блюд!
  • 2 кондиционера, обеспеч ..., 17 фото",Косметический,,Балкон (1),На улицу,Совмещенный (1),Можно с детьми,"Мебель в комнатах, Мебель на кухне, Ванна, Стиральная машина, Кондиционер, Посудомоечная машина, Телевизор, Холодильник",,,,,,https://www.cian.ru/rent/flat/315693687
300025880,2,Квартира,м. Коптево (19 мин пешком),"Москва, Кронштадтский бульвар, 39К2",40.0,"6/9, Кирпичный",наземная,"75000.0 руб./ За месяц, Залог - 75000 руб., Коммунальные услуги включены, Срок аренды - Длительный, Предоплата 1 мес",+79843221453,"Сдаётся квартира с хорошим ремонтом на длительный срок. Смотрите фотографии квартиры, вся информация соответствует. Имеется вся необходимая мебель и техника. Хороший район, развитая инфраструктура. Рассмотрим всех платёжеспособных граждан.

_______
Топ-6 причин почему нас выбирают:
1 - больше 7 лет на рынке недвижимости.
2 - Индивидуальный подход к каждому
3 - Самые вкусные и эксклюзивные предложения столицы.
4 - Сотрудничаем практически со всеми крупными Агентствами и крутыми частными риэлторами столицы.
5 - Работаем с выездом. Остерегайтесь безвыездных мошенников!!!
6 - Услуги оплачиваются строго после заключения договора. 
Мы ценим Вас и Ваше время., 11 фото",Евроремонт,,Балкон (1),,Совмещенный (1),"Можно с детьми, Можно с животными","Мебель в комнатах, Мебель на кухне, Ванна, Стиральная машина, Кондиционер, Телевизор, Холодильник, Интернет",,,,Пасс (1),Да,https://www.cian.ru/rent/flat/300025880
317914288,"2, Изолированная",Квартира,м. Войковская (4 мин пешком),"Москва, 1-й Войковский проезд, 4К1",42.0/27.0/6.0,4/5,наземная,"75000.0 руб./ За месяц, Залог - 75000 руб., Коммунальные услуги включены, Срок аренды - Длительный, Предоплата 1 мес",+79165449287,"Сдаётся солнечная, чистая двухкомнатная квартира в шаговой доступности от метро Войковская и Стрешнево — всего 2 минуты пешком. Общая площадь квартиры составляет 42 кв. м, жилая — 27 кв. м. Расположена на 4 этаже 5-этажного кирпичного дома, квартира очень теплая.  Окна выходят на юг, что обеспечивает приятное естественное освещение в течение всего дня. Возле дома зелено, много деревьев и красивоцветущих кустарников. 

Квартира с качественным  ремонтом, в отличном состоянии. Кухня площадью 6 кв. м оборудована необходимой мебелью и бытовой техникой. В квартире есть кондиционер, холодильник, телевизор и стиральная машина. Санузел совмещённый, с ванной. Куплен новый диван в большую комнату. Также имеется застекленный  балкон, где можно приятно проводить время на свежем воздухе.

Дом находится в отличном состоянии, есть наземная парковка с въездом под шлагбаум (места для парковки всегда есть). Район обжитой и тихий,  со всей  развитой инфраструктурой давно сложившегося района, что добавляет ..., 35 фото",Дизайнерский,,Балкон (1),На улицу и двор,Совмещенный (1),,"Мебель на кухне, Ванна, Стиральная машина, Кондиционер, Телевизор, Холодильник, Интернет",,,,,Нет,https://www.cian.ru/rent/flat/317914288
317292259,"2, Изолированная",Квартира,м. Аэропорт (10 мин пешком),"Москва, Ленинградский проспект, 48к2",40.0/26.0/6.0,1/5,наземная,"75000.0 руб./ За месяц, Залог - 75000 руб., Коммунальные услуги включены, Срок аренды - Длительный, Предоплата 1 мес",+79230755138,"Сдаю 2 к.кв. с отличным ремонтом. Изолированные комнаты: гостиная 16, спальня 9. В квартире 4 окна. Три выходят на ул. Степана Супруна, одно во двор.
Рядом с домом Петровский парк. Дом имеет П-образную форму, внутри которой зелёный двор с детскими площадками и зоной отдыха. Много мест для парковки. Рядом школа и детский сад. Небольшая, но функциональная кухня. Кондиционер, стиральная машинка,ТВ, интернет, микроволновка и т.д. В спальне новая кровать 180х200, в гостиной новый, раскладывающийся диван. Квартира для некурящих. Без животных., 8 фото",Евроремонт,,,На улицу,Совмещенный (1),Можно с детьми,"Мебель в комнатах, Мебель на кухне, Душевая кабина, Стиральная машина, Кондиционер, Посудомоечная машина, Телевизор, Холодильник, Интернет",,,,,,https://www.cian.ru/rent/flat/317292259
314037517,2,Квартира,м. Сокол (13 мин пешком),"Москва, Волоколамское шоссе, 6",56.0/36.0/8.0,2/10,,"75000.0 руб./ За месяц, Залог - 75000 руб., Коммунальные услуги включены, Срок аренды - Длительный, Предоплата 1 мес",+79682374527,"Комнаты 22 и 13 кв.м. Комнаты смежно-изолированные. Кухня 7,5 кв.м. 2 шкафа для одежды. Балкон. Все окна во двор. 2 этаж в 10 этажном доме. 
На длительный срок, залог за месяц 100% не разбивается. Без животных.
Собственник. Без комиссии.
Если вы видите это объявление, значит оно АКТУАЛЬНО!, 13 фото",Дизайнерский,,Балкон (1),Во двор,Раздельный (1),Можно с детьми,"Мебель в комнатах, Мебель на кухне, Ванна, Стиральная машина, Кондиционер, Телевизор, Холодильник, Интернет",,,,Пасс (1),,https://www.cian.ru/rent/flat/314037517
317281826,"2, Изолированная",Квартира,м. Динамо (14 мин пешком),"Москва, Беговая улица, 26",65.0/45.0/10.0,"11/13, Кирпичный",наземная,"77990.0 руб./ За месяц, Залог - 79000 руб., Коммунальные услуги включены, Срок аренды - Длительный, Предоплата 1 мес",+79892716388,"Сдается отличная, большая, 2х комнатная кваpтирa в кирпичнoм доме, cдаeтcя впepвыe, кoмнaты изoлированы. окнa ПВX, свежий ЕВРОремoнт, укoмплектoванa ВCEЙ неoбходимoй COВPEМEННOЙ мебeлью и бытовoй теxникoй, на пoлу штучный пaркeт, большая вaннaя комната в плиткe c подoгрeвoм, оpигинальная итальянская угловая ванная со шторкой, дорогой встроенный кухонный гарнитур с мраморной столешницей и фасадами из массива вишни, на кухне на полу плитка с подогревом, в комнатах: 2- платяных шкафа, угловой раскладывающейся диван, уголок для компьютера, кресло, 2-х спальная кровать, встроенный холодильник, кондиционер, духовой шкаф-микроволновка, варочная панель, бойлер, фильтр обратный осмос, посудомойка, интернет, домофон, металлическая входная дверь. Красивый вид из окон, окна выходят прямо на ипподром, южная сторона. Дом огорожен, въезд через кпп, охрана подъезда и машины, состояние подъезда отличное, вход на этаж через отдельную дверь. Школа, д/сад, больница в пешей доступности. можно маленьких жив ..., 7 фото",Евроремонт,,Балкон (1),Во двор,Совмещенный (1),,"Мебель в комнатах, Мебель на кухне, Ванна, Стиральная машина, Кондиционер, Посудомоечная машина, Телевизор, Холодильник, Интернет",,,,"Пасс (1), Груз (1)",Да,https://www.cian.ru/rent/flat/317281826
293724359,3,Квартира,м. Коптево (13 мин пешком),"Москва, Коптевский бульвар, 16К2",85.0/8.0,"3/5, Кирпичный",наземная,"80000.0 руб./ За месяц, Залог - 80000 руб., Коммунальные услуги включены, Срок аренды - Длительный, Предоплата 1 мес",+79813687511,"Виктор. Сделаем РЕГИСТРАЦИЮ для ДЕТСКОГО САДА  и ШКОЛЫ . Сдается ПРОСТОРНАЯ трешка в Сталинском доме с ИЗОЛИРОВАННЫМИ комнатами ОБЩЕЙ ПЛОЩАДЬЮ 85 м 2. Потолки 3.10. По желанию собственники могут купить 2 х СПАЛЬНУЮ КРОВАТЬ и установить КОНДИЦИОНЕР. Рядом Тимирязевский парк с прудами, квартира находится в окружении двух бульваров, все окна выходят во двор, рядом ДЕТСКИЙ СПОРТИВНЫЙ КОМПЛЕКС  ""Бригантина"", рядом детская поликлиника, Коптевский рынок с фермерскими продуктами. М. Коптево 13 мин.пешком, м. Войковская 10 мин.транспортом. Развитая ифраструктура. Рассмотрим СЕМЬЮ с детьми и маленькими животными. Длительный срок., 26 фото",Евроремонт,,Балкон (1),Во двор,Раздельный (1),"Можно с детьми, Можно с животными","Мебель в комнатах, Мебель на кухне, Ванна, Стиральная машина, Кондиционер, Посудомоечная машина, Холодильник, Интернет",,,3.0,,,https://www.cian.ru/rent/flat/293724359
317743979,"3, Смежная",Квартира,м. Стрешнево (5 мин пешком),"Москва, Светлый проезд, 6К4",55.0/29.0/10.0,"5/5, Кирпичный",наземная,"80000.0 руб./ За месяц, Залог - 80000 руб., Коммунальные услуги включены, Срок аренды - Длительный, Предоплата 1 мес",+79945051480,"В одном из ещё оставшихся тихих уголков старой Москвы сдаётся квартира на длительный срок со своей мебелью. В квартире есть всё необходимое для комфортного проживания, встроенная кухня оборудованная техникой европейских марок Miele, Liebherr. Санузел большой, совмещённый с бойлером на случай отключения горячей воды. Два шкафа-купе в комнате и прихожей ( без спальных мест).Сдаётся супружеской паре, можно с ребёнком. Окна выходят в тихий двор, имеется не застеклённый балкон. Дом без лифта. Рядом красивый парк Покровское- Стрешнево. До метро Стрешнево ( МЦД и МЦК) 200-300 метров. Дополнительно оплата по счётчикам за свет и воду, 23 фото",Евроремонт,,Балкон (1),На улицу,Совмещенный (1),Можно с детьми,"Ванна, Стиральная машина, Кондиционер, Посудомоечная машина, Холодильник, Интернет",,,,,,https://www.cian.ru/rent/flat/317743979
